{"schema_version":1,"dimension":2,"grid":[48,48],"nframes":11,"times":[0.0,2.6,5.2,7.8,10.4,13.0,15.6,18.2,20.8,23.4,25.9],"downsample":"scipy.ndimage.zoom(order=1)","lenses":{"phase":{"source":"arg(psi)","unit":"rad","transform":"linear","cyclic":true,"geometry":"plane","vmin":-3.141593,"vmax":3.141593,"quant":"uint8","data_b64":"AMIFu6Z7Yen4I4anfpRoMVlIM0wyByozUTY0xMOuKJdXYo3ed/aOJHVcOxTyMe7fOnwyNnyNcGZyTO3f/Vcu64ZvR2UhBfOskwamoI9oXnl3XJ3EeO+U1Ep1CgXBbTwNVn2i8qW1lHeMz8W3+cPsHlWhfJ3b8OjGsuyqg2csXLKRGfD6QDNjqbOs/emUizwzKODFq3zg5KTOz+szC8CbhD/bv5On9JevrGmCd+7TxLiT7PIcWFRpZceiwsuzo7AYMR/wL1JeQcweMtVA061qcLDO27y9Wm19on+Tj+zR5tWPdtILRC5PKw70s73qNys+CwHzdYNoUHmhmN5Cvk1AWa644b25TU0ptwkboHRPpURoJwi96hwlA/rqkLPbur7vBdXoi7vVCzWFpOhQmX1lUNbHw8W12UxbFx8dw7P+8xtMQBA9LwpEd61+ZmTWys/qjt/xEtD4DEBYnYfcn5+zJLmzuPWDTG8eBgLDrrzY0akrUFWqKSydrX9/hFHOq8qiZ1CC/f7mrT9yvcYJBQ2TYaGI49bUb6mceD64Uo6PO7nwEX27Gxf67jh1ESP5c6h7T2mv7HAgtL6cawT2+hjqYmRgY7nL4gwpIOGgSyGrMsvY+Pbv7V4nIEI+MqusXYVb7GHAtH8xJPGKf/vsUAwHB9KwZe+fwuuu9sjAyPeeLyca4Ong1nyv5BeXnoM/YFsU9kh7j5a6ni5LZztsg/sm8bcL/N6HWP/h88CsxMyu5DCFq/aU5XuWk3M3CxEd9fPncVt1WaS+kUgX8+WrjEcWOJjBs8eIeOoONJB1XnK/1kmvn50I8aj6QlAR3YlnDxe+h3iu6UVklC7leKn5VIHb2Y9slsW3NZMPAw01SrayPBKlhp1EVLj1OSKomltcNB0SXzBP3JBqClKEpcLxp86ZOowBkcSr0yAeTVBOYM7fFQAKt7QLdrrHnKGsqN6FXmNsURH7MBo9QS2OgJ7yx8+t7OdMRyOp4xhDWURTRPI2QOIH5aiwzDB6T5UgB+qgjXmCEpDs665vPRA7GOj9Qpp54fk9j/U4RjDXuMKZA9P4NwEeqmxdOuPxHINriZ7qvc3b+WWr2OSeYassL0Uo7dTOl0obf4RYO2TmEVdjCCorbOK7lCEk18AtN964n2sinN7oSfi4w2Wove1Pa3dVPxsVVii7r8aRJ03cC/Dq1jcHHOXDfPFE6K9TTFfZrisPA7qLY9XbaS5aURciAIIV7Nns9dCpAt/0akrgWtC3UUV8WgbZdPSSxoRYT5jZ7yd5KA9whY24YFZWNA8A4hPwxtbRvdPkVu8laWRfbsDNh5rXmurdxNrZ5mBq+Pvdm8fAzbNkRhrAhXLWJA7yzDZckLDDocCZeOOHkGFha6O9bEH81+7xAfnhMx2DVkDgXNvzonJHC+Mx/laNWg0c5FN8j8b9rsXRXVmccnCnUWridUlRUBkeFyulsK1u737P0zZ4jp4x1CFIj4n0DNKeomazcSjcotediEbrU3FbXO10gXZ/qAkNuOrcutkC9HmWUEgwssPAujo7n5gWM+Hp49Wlmw0Q+A2O10QsHV/l1t+JlrHHvAxK3hLkBhAb7ayzeGN5pIrCip/MoVZIconZ4IqXpNLFcWSI3478L1r+47iUw7KTDjyVuw3TuNJrlMnG5RJtAVLLv/o5YGKvdHNl8Y6Rqs7mhaO9uqUtXoOXSCdq5duSPnOkXBDV2fMLq+jXzF10qrrp9fUINiXvAX4+MYJ+mDtRYUBhd1BVre9O+e2i4yxtIIzcU2GaYXK6gIqYLV6QbeQQ3vnuYQNKNhcqO2tvlkKGwA9bhauioaR9BeRI/3HZnHRelG6XtpJiPWRsgVmrbHAbkAaxi1eBw+gFYGOsZkvI6Qg3QQdFnpXBJQ//+SUhMTxw1qZ9RPlcUl0/59GpjcBulI2I8hVHIioqhXuZSm9TGugNEeyqRGOAW5mCExqpEiRPF7BVO+4joiQdC/4v9cxpdoU9BPvaIgry4FF8KHB43RQXTZeqP0zb8tibKyyZhqWm9eIUJSxzr0xeosC73cmDlq0Bw8PKHBI5aH+Nt6KHVl9EJa17NrW0SepLE9noiSd/H1LeZjVqlFmOCdi+vrKXx7Cbpuq1PmRqlXddN7CJRpGglMafuK2hZaDW887tCvbXQu3nTkg47ArV9tNoL6+TmYFP/QLbCMCDlezO2otNOmfAiU4sUneYRgTqBoR2XOPEfrCsMaNc+gjn5SFlq8N6OqSg+h9TP/7d6p5shZfFhIA9gE4xdlptzgT/79jVVfD/RlNTLaabGf3rukVf0dOpPrvpDC9nUlCWJ/hr0bCTcAdm9vwbgpV7nzpha459tN0OMm52aI28BKiywcML6tzqq/QPv9qkYTGHnc+hv8OiKNy8uZIeTxQx5gxn7Ne5y9bjhH6XiqV5OqxfU84XFvSywq84UDY4VhFvpM/pt77Q79/U9J/zdSxC1R1cIPrOtmh2oHd8c6VIVJs4TZWZpM2x04OAhEdZK+yXUTg4hLrOXUOpSiUbPZywtf8i23I67mkvUHXyGLxDU3xlWJG7ysyfuINwiEErHmuOJiAlxOcC8PSuiKTmRMnazfpHimpL3q47+KsANLCyapHOYnOx9O0M1XRPgtb5wY5yaZuEuK8++veDoSWGH7WQn9iwwsz+KTjv7GoXOMV2Yb/fe7epCBMb1plgf90YDmdQea+OlQ024M7j0t5oTZ6yCBbryE8oUFl/uk5pu5xnYoTo2+RBwprlHkFocPA7BgIHf95RahElOWfZ7e5SkmjFBR0LGzsEelRIis/BvpViQhINwnhyx44pabjDgQU4AxwSNhn2p9P9DjQ2HwsWZE/dUQcODVrS3x8P0rC+4OQki6SUsLPGOEZTkJC6ieH3xJCeUDwVa1kw5ycIJ8/draO/OMrZAi3d7SS+zL6wA8YXd8lTgpOOVTM6eWiLX+4b+m7PUDfNl5BDsHDZUGfQk8FNWYXFuZYiAZKTvs/XnrPEUujOtySIvvmwE3+egLc7Fvu4lERjf6bt/Xh6jRYujsE7eWNt190lVnt6c5d5e8iQSTWPsUaQR8UJZnuKkJKRjoqGiJakp51qUU5MRTciDqOSkpedoJ+YkY6Pk5icnpuXlpmepKage1lYU3aMkpKRj5CWp7nAvrWegnyDmsDPyraimZeYmpmVkIyLjY+PjIeGjJejrLCwp09GKlKWl5SSkZSftMTJxrysoqWttbzBvrOkm5iXmJmXk4+Lh4FzZWJrfpipsrW3uuAjCP3Fo5iTkpemu8jKxbmrqa60uby8ua+jm5iYmpydnJaNe1hEQUVNZZ2wtbi7wdb89/XkwKOVkpiqvsbHv7CmqLC2uru6taugmpmbn6SoqqmdNi8vMjU5QKq1t7q9xNTr7e/p28OikZesvMLBt6ihpq+2uru5tKqgnJ6jqa+2vs79GiElKCssK9G4uLq+xdHi5enn5OLn8JasuL6+taafo621uru6trCqq7CztrvCz+T/EBgcHyIjIxG5t7q+w8zZ2eHj5Or4DSmruMHEv62ho6y0ubu8vL7Gz83GwsTL1+n6Bg0RFRgcHyWjsLW6vsPNr7zM2Oj8EzKkvMzW2c6wqa60ub2/w8zY39rQycjP2ufy+f0CBgwTHy4/WJKora2scXiDkZ5BQFJ5x97p7+/du7S2ur7DytXg5ODVzcrQ2eLp7O7w9PoJITU/RUxYZm1vZW53foB3aGFj5Ozx9PPpz725u7/Fztrl6eXaz8zQ2N3f39/g4eb3KDxBQ0VJT1ZdYGlyeXt2bWVhLerr7Orh0MC6u77F0eDt8u/j1dHU2drY1dLR0dLXPEVFRUVHSk9XXWZvdXdzbGVilNzd3drUyb+5uLzE1Or6AgP66N/g4N3WzsnGxMK6aFNPTUxMTVBWXWRscnNvZ2FeztbV09DLxL23trrE3PoMFRkYC/nx7OXazsXAvLmtgWlnZ2JbV1dZX2NrcXBpYVlQAdzV0c3JxL23tLfH9REbISUkGQr/9+/j1Me+ubSlhn+Ijoh4amJfaGx5gHNjV00/Fuvc1c/Lx8G6tLXoGSAjJiglHBAG/vbr3M3Cu7KVeomcoqCWhXRrjKKzsZRdSj8yHP3n29TQzcnDuq4vKykoKCciGhEJAvnv49bLw7JUWIursbGto5WJqbO5urNKOTEpHQnx4dnU0c7Kw5w/NzIuKiUgGRILA/rw5t3X1y4/PhPDwcC+ua+mpKqwsrErKSUgGQny4tnU0c7JwaRXSkQ+Ny4kGxMLAvjw6OLg6ic2Lwjc0c3KwbKll5ygoZUmIBsXEAHp2tTQzcrFvKBtXVlZWlxTNRoLAPfw6ubl7RMpIAHm29TNvKSXjpGSi18mGhMNA+/Zz8vKyMXAtpp0Z2VnbXN2cU8M/vfx7enm6fgMCfbm3NLBp5WOjo2JfFIlFQsC8trIw8PEw8C7r5R0aWhscnl9fnoR/fj07+rm5eju7eXbz72lmJGPmJOIdVImEALz3se8ury+vru1qY5yaGhtdX2DhYaR+vn18Ork4eDf29PHtqGWlJWXrKiQclcwDvbgybiysbW4uLawpIpwZmdueoSLjY+X7/n27+fh3dvX0MW3ppeSlZ2mxMiwZ1ZEH+rHtaypqa2wsa6onIhxZ2dxg5CWmJiatvbz6uHc2NXQx7utn5SRmKa31d7tP0pIRV6dn56eoKOmpqOdlId5cG99mKWmpKCakIXf2NTR0M3Gu6+jmJGRmq/G3ej6ITg/RFJzh46RlJaXl5SQi4eDgoabucC9tamWgXZ5ka+7v72zpZuVj42QnLXO3On7FSgyOkddcn6EhoeFg4GAgoaJjJOozNna1cGGc3Bze4qYnpmNhoSFhoqRn7bM0OH2DBslLjtPZXJ4enl1b2tueIOLj5Wk0urx9gFLZGltcnl9fHVwcHN4gIqWpLPCwNDpAQ8ZIzBFXGtydHFrYlpca3+Kj5Oez/P8AwwnUGBmaWtpZWFhY2dvfpKiq7G3tcDa9AUPGSc9WGlxcnBpX1ZVZHuIjZGZwfP9BAkVMU9ZWlhUUlNWWV1nhaavsbGxsbrQ6/sHEh83WW10dnNuZV1cZ3mFi4+Xter4/QACBxYvOj5BREhLTk9Ut725tbGvsbnN5fUCDRs3ZHd9fnt2b2lobniBh4yUrN/w9PTy8PL9Fy03PUBBPzQL3MvAubOwtLvN4/QBDBtIeoaKiYaBenRxc3d8gYaOpNbo7Oro5ebsAyk5Pj46Lhb45NTHvbezub/P5vcGEyt2jZWYl5SOh4B5dnV3en+GmdDj5OLf3t7h7jxKSUQ5JAjz5djMw7y5v8TS6wQXLViDlZ6jpKOfmZGFeXJxc3Z8i8/g39vY19bUxG5iXFVIKgXv4tfOx8K/w8bS9x4zSWaClqKqrq+wr62jiG9oaW1xe9zg29bT0tDIqX9ybGZgVCfk1tDMycbEw8LGLD1GU2Z9kqOutbm9wcTHyVlVWmBlBOrk3NXRz8u/oIR6dHBraWyEr8DGx8fFv7eaWU1OVmR2ip6vucHHzNHW3vIcNjvp5+ro4trV0cq6nYh/eXRwbnB6kay9xMXEuKR/YVRRVmBuf5Wru8fP1tre5O36+N/a4Ojt7enj3NK7no6GfnhzcXN6iaC0wMPBrZB2Y1ZQUltndIahu83Z4OPl5+vr3dHU3uny+Pv7+OvGp5uSiX53dHZ9ipyvvMC8l4BxYlNKS1NfaXeNudnm6+3t7ezl0crT4e75AQcLDAXWtKykmYuAe3yDjpyqtruyfXZvYkw+PkdTXWZwr/H2+Pf29fLozsjX6fb/BQoOEAjTurWwqJuNhoaMlZ2jqKSNcHNyZkAtLjhETlVVOAwGBAIA//7418rj9v4DBwoNDfzGube1saick5GVmpybkHpvbnV6dzMeIy46RElJOBsQDQsLCw0SHRYDBAQFBQYHA925tbW1s66mnpqcnZuTgG1pb3mCiZgSHiw4QUZIPiUYFhYYGh0lN0YxEwcC/v376rasrbCzsq+po5+enpqOeWlocHyGj5edNDlARktQTTQkIiUoKiwvOUlPOQLx6+bYsJ+fpKmtrq2oo5+fnpqMdWZnbn2IkJSTinRgWV1ocl06Njg5ODQxNExsgZqwt7SmmJOVm6GmqKainpyen52QcmFif4KHi42NjIqJi4+Yoq3G+QH25NHAsaijoaGioaCdm5qZmpucnZycnZ6goaGfl4qAiouOkJGSkpSXnqatsbGwr7G1uLi2sKmjoJ6enp2bmZeWlZWUlJSWmZ6ipqmpp5+Sq5+Zl5aWl5mfp6+0tLOwsLGztre1sauloZ+enZ2cmpeUkY2IhISKlJ6mrLCztre2yb6top2bm56lrbO2trOxsLK0tre2s66oo6GgoKCfnpuWjXxoXF1si6GssbW5vsTJ09DEs6ehoKOqsba4trOxsbK0tre3tLCrp6SkpKWmpqajijo0NDY7WKqytrm9wsjP1dbQw7Sqp6mvtbm5t7SysrO1t7i4t7SwrKqqq62xtb7VAxggJCYoJMu6uru/w8nQ1NbUzMC0rq6zuby8ubazs7S2uLm6urm3tbS0tbi+xtTp/QwUGR0eHAPEvLy+wsjOzdDPycC1sLG3vcDAvbm2tba3ubu8vr/AwMDAwcTJ0t3r9wIKDxQYGRTgvbq7vsPIrayppaCcnqq5wsfIxcC7ubi5u72/wsbJzMzLy83R2ODo8Pf+BQsRFx4llKaqrK2udHd7fX19f4yyyM/QzsjCvru7vb/Cx83S1tbV1NTX29/k6e3y9/8JFiY3Slxpb3JzaW1xc3Rzc3aUztbX1M/Iwr++v8HFy9Pa3+De3Nvb3d/h4uTm6vD8FC5AS1NZXWFlZWptcHFwbm1309rZ1tHLxcG/wMPI0Nrj6evp5uLh4N/e3d3d3uHqDTtJT1NXWl1hZWlsbm9ta2ho29vZ1tHMx8PBwcTL1eLu9fj28uzo5eHe29jW1NTU3FFUVlhaXF5hZmlsbm1rZ2FW6N7Z1dHNyMTCwsXO3e/8BAYE/vfx6+bg29bSz8vGsHNlYmFgYGFjamxub2xnYFU79uPb1tLOycbDw8fT6gENERIOCAH58uvk3tjSzcjArY19dnJtamhoc3R0cWthVUMm/une2NPPy8jFxMjaARQaGxoVDwf+9/Dp4tzW0MvCs6CXkouDe3VzgYB+eGpXQzAbAu7h2tTQzMnGxcfiHCUmJCAaEwoD+vTt5+Hc19POxLevqqSckomEkY+Mg2hDLyIUAvDj2tTQzcnGw8C9OjczLykgFgwE/Pbw6ubi4N/e2c7Du7Sto5qUmZeVjV0sIRgO/u7h2NLOy8jEv7N+VktGQDcqGw4E/Pbx7enn5ubn5NrPxb20q6Odm5mXkEIgGBEH+Onc1M/LyMXBuaeBZ11ZVU9CJg8D+/Xx7uvp6Ojo5N3SyL+1rKSfm5iVjTEaEgr+7+DUzcnGxMG8s6CDcGlmZmZjUhD9+PTw7evo5+bk4NnQxbuxqaOem5iUiC4XDgP049TLxsPBv7y3rZuEdW9ucHN2eZLy8/Hv7Onn5OLf2tLJvrSrpaGenpuVgi4YC/vn08fAvby7ubaxqJeFeHNzdnp/hZTU6u3s6ufk4d3Z0sq/taymoqCfpaSedC0eDvPUwbm2tbS0s7CropSFe3d4fIGGjJa03efp5+Tg3NjSysC1rKWhoaKkr7S7GyooIPG1rquqq6ysq6mknJGGfnx9goiOk5mnx93i4d7a1tDJwLWrpKCfoaWqusbdDSQsNFePmZyeoKGioqCclY2GgoGEipGXmp2hrsbU1tTRzMa9s6mhnZudoaiwwdDoCB4rOFF0hY2Rk5WWlpWSjoqHhoeMlZ6kpaKdmJuqub6+u7SropuXl5ico6u2xNPoAxclNEljdn+Eh4mKiomIh4aHiY2Uoa+5u7KbhX6AiZOampaSjo2Okpedpa64w9Dk/BAeLUFZa3Z7fn9/fn5+gIKGio+Zq8PT3ODVbG1vc3Z4eXl6fIGHj5egqLG5wcze9AgXJjlRZXB1eHl4d3Z4e3+EiZCbsdDj7fQCMlliZWZmZmdpbnaBj5ymrbO5v8nY7QEQHjJMYm50dnd2dHN0eH2CiI6Zstbo8Pb8CjBPV1lZWVpdYmx+laWtsbW5vsbU5/kJFytLZHF2eXl3dXR0d3uAhYyWr9Xn7vL0+AYrRk1PUFFSVl+AprG1tri6vsXR4vQEEidQbXh9f359enh3eHt/g4mTq9Lk6uzt7vIEMERJS0tLS02lvL28u7q7v8XP3vABEClje4OHiIiGgn98e3t9gYaPqM/g5ebm5uftE0FJSkpHQzfaycTBvr29wcXN2+4CFUF6iI6Sk5ORjomDf319f4OMp87c4eHh4N/f501SUU9LRSzZzcfEwb+/wsXL2PAQNGaCj5aanZ6enJePhoB9fYGLq9Db3t7d29jTw3ZjXlpXVFXMycfEw8HBwcPH0gc+VW2CkZqhpqmrq6mjloiAfYGQvNbc3dza19PKsoh0bGhmaHqvv8PDwsLBwL++slNUXWx+j5ulrLK2ubu7tqWOhYuv1N7g4N7b1tDDq45+dnJxdH+YsLu/wMHAu7eqdVtZXmh3iZqnsbnAxcrO0NHNx87b4uXm5eLe2dDAqJKFfnp4eoCPorG5vb69tKqPalxZXGRwgJSntcDJ0NXa3uDi4eLl6Ovs7Orm39PAqZiMhYB+foOLmaext7m4qZh9ZltYWV5ndYmjusnT2t/j5ujo5+bp7PDy8/Lv6NnCrZ+VjoiFhIaMlaCqsLKwmYh0ZFpWVVheZ3aWwtbf5enr7e7s6urs8PT3+fn2797EsaaemJKNiouOlJuip6ikin5xZFpTUVJWWmBn4+ru8PP09fTy7+7w9Pf6/Pz58d3Ds6umoJqVkpCRlJicnZuUgHlxZ1tSTk1PUVFJHwP9/Pz9/f379/T19/r8/fz57dS9s62qpqGcmJaVlpeXlY+He3dzbWJVTktLTEpCLBULCAcHBwcGAvz5+fr7+/ny4MS1r62rqKWhnZqZmJaTjoZ/eXh4dm9iVk9NTElCMh8VERAQEBEQDAT79/b18+3fxbOtq6qpqKajoJ2bmZeSioF7eXp9fn13a19XU05HOCYcGRcXGBgXEwTr4N7c1sq6raelpaampqWjoJ6dm5iSiX96en6ChYeFgXlwaWJZRSwhHRwbGRcR8LKrrK6wrqqloZ+en6GioqGgn5+enpyWjYJ7jIqJiYmJiIiJi5CZqbvJz9HPy8W/uLKuq6mopqSjoaCfnp6enp2enp+foKCem5aRl5ORkJCQkZOWmqGorrO3uru8u7m2sq6qqKako6Kgn56cm5uampqbnZ+ipKWlpKGcpZ+bmJeXmJueo6mtsbO0tba3t7a0sq6rqKWko6Khn56cmpiWlZaZnaGlqKutrq2qs62noZ6dnqGlqa6xs7S0tLW2tra1s7CsqqempaSko6GfnJiSjo+VnaSqrrGztre2vbixqqWjo6aprrG0tLW0tbW2tra2tLKwrauqqampqqqrqqiJR06EpKyws7a4u72+wb64sauoqKqtsbS2tra2tra2t7i3t7a0srCvr7CytbrD1PIKFRkX98C5uLm7vsDBwb65sq2qqq2xtbi5ubi3t7e4uLm6urq5uLe3uLq+w8vY6PcEDBESC+nFvbu8vb/BuLW